{
  "$schema": "https://json-schema.org/draft/2020-12/schema",
  "$id": "urn:ara:prototype:microsequence:0.1",
  "title": "ARA prototype microsequence",
  "type": "object",
  "additionalProperties": false,
  "required": ["contract", "version", "id", "title", "objective", "track", "cards"],
  "properties": {
    "contract": {"const": "ara.microsequence-prototype"},
    "version": {"const": "0.1.0"},
    "id": {"type": "string"},
    "title": {"type": "string"},
    "objective": {"type": "string"},
    "track": {"enum": ["semantic-mathematics", "relational-construction", "executable-programming", "source-argument"]},
    "cards": {
      "type": "array",
      "minItems": 3,
      "items": {
        "type": "object",
        "additionalProperties": false,
        "required": ["id", "role", "componentRef", "content"],
        "properties": {
          "id": {"type": "string"},
          "role": {"enum": ["theory", "guided-practice", "independent-practice", "reflection", "transfer"]},
          "componentRef": {"$ref": "common.schema.json#/$defs/componentRef"},
          "content": {"type": "object"},
          "scaffolding": {"type": "object"},
          "dependsOn": {"type": "array", "items": {"type": "string"}, "uniqueItems": true}
        }
      },
      "contains": {
        "type": "object",
        "properties": {"role": {"const": "theory"}},
        "required": ["role"]
      },
      "allOf": [
        {
          "contains": {
            "type": "object",
            "properties": {"role": {"const": "guided-practice"}},
            "required": ["role"]
          }
        },
        {
          "contains": {
            "type": "object",
            "properties": {"role": {"const": "independent-practice"}},
            "required": ["role"]
          }
        }
      ]
    }
  }
}
