[{"contract":"ara.microsequence-prototype","version":"0.1.0","id":"micro-math-factor","title":"Fatoração com equivalência semântica","objective":"Reconhecer e produzir uma fatoração equivalente.","track":"semantic-mathematics","cards":[{"id":"math-theory","role":"theory","componentRef":"org.ara.prototype.semantic-expression@0.1.0","content":{"explanation":"Fatorar reescreve uma soma como produto sem alterar seu valor."}},{"id":"math-guided","role":"guided-practice","componentRef":"org.ara.prototype.semantic-expression@0.1.0","content":{"expression":"x² − 5x + 6","task":"Complete um dos fatores: (x − 2)(x − ?)."},"dependsOn":["math-theory"],"scaffolding":{"showRoots":[2,3]}},{"id":"math-independent","role":"independent-practice","componentRef":"org.ara.prototype.semantic-expression@0.1.0","content":{"expression":"x² − 7x + 12","task":"Produza uma forma fatorada semanticamente equivalente."},"dependsOn":["math-guided"],"scaffolding":{}}]},{"contract":"ara.microsequence-prototype","version":"0.1.0","id":"micro-graph-path","title":"Construção de caminho em grafo","objective":"Construir caminhos preservando o estado relacional.","track":"relational-construction","cards":[{"id":"graph-theory","role":"theory","componentRef":"org.ara.prototype.relational-construction@0.1.0","content":{"explanation":"Um caminho é uma sequência de vértices ligados por arestas consecutivas."}},{"id":"graph-guided","role":"guided-practice","componentRef":"org.ara.prototype.relational-construction@0.1.0","content":{"task":"Conecte A a C usando B.","allowedEdges":["A-B","B-C"]},"dependsOn":["graph-theory"],"scaffolding":{"highlightEligibleTargets":true}},{"id":"graph-independent","role":"independent-practice","componentRef":"org.ara.prototype.relational-construction@0.1.0","content":{"task":"Construa um caminho de A a D com no máximo três arestas.","graphId":"g2"},"dependsOn":["graph-guided"],"scaffolding":{}}]},{"contract":"ara.microsequence-prototype","version":"0.1.0","id":"micro-code-function","title":"Implementação e testes de função","objective":"Passar de leitura de contrato à implementação testada.","track":"executable-programming","cards":[{"id":"code-theory","role":"theory","componentRef":"org.ara.prototype.executable-python@0.1.0","content":{"explanation":"Uma função deve respeitar entradas, saída e condições declaradas."}},{"id":"code-guided","role":"guided-practice","componentRef":"org.ara.prototype.executable-python@0.1.0","content":{"starter":"def double(x): return __","publicTest":"double(3) == 6"},"dependsOn":["code-theory"],"scaffolding":{"editableRegion":"return-expression"}},{"id":"code-independent","role":"independent-practice","componentRef":"org.ara.prototype.executable-python@0.1.0","content":{"task":"Implemente sum_even(values).","publicTests":["sum_even([1,2,3,4]) == 6"]},"dependsOn":["code-guided"],"scaffolding":{}}]},{"contract":"ara.microsequence-prototype","version":"0.1.0","id":"micro-source-evidence","title":"Evidência e justificativa","objective":"Vincular uma afirmação a um trecho de fonte e explicitar a relação.","track":"source-argument","cards":[{"id":"source-theory","role":"theory","componentRef":"org.ara.prototype.source-argument@0.1.0","content":{"explanation":"Uma evidência não sustenta uma reivindicação sem uma razão que torne a ligação explícita."}},{"id":"source-guided","role":"guided-practice","componentRef":"org.ara.prototype.source-argument@0.1.0","content":{"task":"Selecione o trecho que informa quando os estudantes podem estudar."},"dependsOn":["source-theory"],"scaffolding":{"candidateSentenceCount":2}},{"id":"source-independent","role":"independent-practice","componentRef":"org.ara.prototype.source-argument@0.1.0","content":{"task":"Anote a evidência e escreva uma razão que sustente a ampliação do horário."},"dependsOn":["source-guided"],"scaffolding":{}}]}]